기업이름,고용형태,연봉,기업주소,키워드,담당업무,필요역량
펀진,-,-,서울시 성동구 연무장5가길 7 현대테라스타워 East동 13층,딥러닝,",      딥러닝 모델 학습 시스템 자동화 및 효율화, 	서비스 내에서의 데이터 수집, 정제 관련 코딩",",	정형/비정형 데이터 활용한 ML 모델 및 알고리즘 개발,	AI 모델 파이프라인 구축 및 시스템 자동화,	학습 데이터 전처리, 가공, 분석,	Python,	딥러닝 프레임워크 경험(Tensorflow, Pytorch 등),	OpenCV, Pandas 등 데이터 처리 라이브러리 경험,	C++ 프로그래밍 언어 활용 능력 보유자,	Inference engine 경험자(TensorRT, ONNX 등),	석사 우대"
안티그래비티,5년,-,서울 성동구 성수이로22길 37 (성수동2가) 아크밸리 지식산업 센터 303c호 안티그래비티,딥러닝,# 업무 소개기술개발목표: 3D 가슴 Template과 2D 상품 이미지 style-mapping 알고리즘 개발# 주요 업무- 2D 상품 이미지-2D 탬플릿 간 style-mapping 학습 알고리즘 개발- 2D 상품 이미지-2D 탬플릿 변형 GAN 알고리즘 개발- 가슴 이미지 변형에 따른 mapping 결과 GAN 생성- 2D style-transfer to 3D 정합 알고리즘 개발- Mesh 변형에 따른 속옷 mapping 결과 후처리 알고리즘 개발,"# 자격 요건어디 이런 분 없나요?- 경력 5년차 이상- 2d to 3d landmark 추정, texture mapping Computer Vision 기술 연구개발 경험- 3d style-transfer, 통계모델(SMPL,DECA,FLAME) 연구개발 경험- 3d 데이터 기반의 AI 프로젝트 경험- SOTA 최신 논문 기술동향 파악 및 알고리즘 분석 능력- Deep learning 알고리즘 설계, 구현, 검증 경험- Image Prcessing, Computer vision에 관한 전문 지식 보유.# 우대 사항이런 경험 가지신 분, 레드카펫 깔아드립니다.- 컴퓨터비전 석사 이상- AI/이미지 프로세싱 연구 프로젝트 경험 2년 이상- Deep Learning 기술 접목한 서비스 구축 경험- AI/머신러닝/딥러닝 관련 논문 발표 경험 보유"
아이네블루메(채티),3년,연봉업계평균이상,서울특별시 강남구 삼성로 571 K빌딩 8층,딥러닝,", 콘텐츠 개인화 추천 AI 설계 및 모델링, 개발, 머신러닝 & 딥러닝 플랫폼 이용해서 콘텐츠 분류 및 개인화 추천 서비스를 위한 기반 기술 연구, 자연어 처리 및 분석 알고리즘 구현",", 머신러닝/딥러닝 기반의 Prediction을 B2C 서비스에 연동경험이 있으신 분, Python 사용 경험이 있으신 분, OS, Network 를 중심으로 컴퓨터공학에 대한 기본 지식이 탄탄하신 분, 다음 항목 중 두 가지 이상에 해당되는 분- AWS 혹은 GCP와 같은 클라우드 플랫폼 환경에서 AI 엔지니어링 경험이 있으신 분- 리눅스 환경에 대해 잘 이해하고 계신 분- 컨테이너 환경에 이해가 있으신 분, AI 엔지니어링 경력 3년 이상, 아키텍처 설계에 관심이 있고 능동적으로 더 좋은 코드를 만들기 위해 노력하시는 분, 다양한 타입의 데이터베이스(RDBMS, NoSQL 등)를 적재적소에 활용하실 수 있는 분, Deep Collaborative Filtering을 B2C 서비스에 운영해보신 분, ML 관련 Low latency API 개발 경험이 있으신 분, B2C 서비스의 실시간 빅데이터 환경에서 Online Learning 또는 짧은 주기의 배치로 학습해보신 분, Devops 경험 (Infrastructure as Code, 배포 자동화, CI, TDD, 모니터링 등), 서비스에 대한 애착과 책임감이 있으신 분"
이스트오토,-,-,용인시 기흥구,딥러닝,", 어라운드뷰 카메라 영상처리 딥러닝 개발","- 컴퓨터비전, 또는 기계학습과 관련된 전공 또는 직무경험- 프로그래밍 (C/C++, Python 등) 기술- CUDA 프로그래밍 경험"
아하랩스,-,연봉업계평균이상,경기도 성남시 분당구 성남대로 43번길 10 (하나EZ타워) 712호,딥러닝,", 당사의 AI 솔루션 연구 / 개발, Anomaly Detection, Semi-Supervised, Self-Supervised 개발, Video, Vision 관련 Classification, Segmentation, Object Detection AI 모델 연구 / 개발, 모델 최적화 및 경량화 연구, 개발",", 딥러닝 연구 경험자, C/C++, Python 숙련자, 관련 딥러닝 모델 연구 경험자 우대, 영상 스트리밍 / 영상 처리 경험자 우대, 다양한 도메인의 지식을 보유한자 우대"
한국딥러닝,1년,-,"서초구 강남대로 527, 브랜드칸 타워 6층",딥러닝,"■ 이런 일을 하게 됩니다- 사업/과제 (정부지원 사업, B2B 사업, R&D 사업 등) 공고 모니터링 및 검토- 선정되기 위한 전략 수립 및 사업계획서 / 제안서 작성- 사업/과제 협약, 프로젝트 진행상황, 개발 및 완료 상황 등 전반의 관리- 내/외부 관계자와의 커뮤니케이션- 관련 보고 문서 작성 및 사후 관리","■ 이런 분과 함께하고 싶습니다- 연구개발 과제 및 정부지원 사업 관리 업무 1년 이상- 과제 주관과 실무 담당자 간 소통 및 다자간 협업을 이끌어 내실 수 있는 분- 기획서, 제안서, 사업계획서 등의 문서 작성이 가능하신 분- 필수 제출 서류 (한글 또는 워드 문서 1개 이상)*기존 본인 작성 또는 참여한 문서, 불필요한 부분은 블라인드 처리 가능■ 이런 분이면 더 좋습니다.- 창업 경험을 보유하신 분- 정부 및 공공기관, 기업 대상으로 커뮤니케이션 경험이 있으신 분- IT 전공 혹은 개발 프로젝트 경험이 있거나 지식을 보유하신- 정부 지원사업 관련 규정 및 지침 지식을 보유하신 분- AI / Data 관련 이해도가 높으신 분"
스카이랩스(SkyLabs),-,-,"성남시 분당구 판교로 255번길 58, 씨즈타워 703호",딥러닝,"- 생체 신호 기반 딥러닝/머신러닝 모델 개발- 내부 토론식 세미나를 통해 문제점 및 해결방안 도출- 데이터 전처리, 통계 기반 데이터 분석","- 딥러닝/머신러닝에 대한 개념적인 이해 및 모델링 경험- 논문 기반 분석 및 모델링 능력을 보유하신 분- Python 프로그램 개발 능력- Tensorflow/PyTorch 등 딥러닝 프레임워크 개발 경험자- 데이터에 대한 통계학적 이해 및 분석 경험- 병역특례 전문연구요원 가능- 디지털 신호처리 알고리즘 개발 경험자- 통계학과, 응용수학과, 산업공학, 전자공학, 컴퓨터공학 등 관련 분야 전공자- 딥러닝 논문을 코드로 구현하고 실험/분석 역량 보유자- 의료, 보건 헬스케어 관련 기초 지식 보유 또는 관련 프로젝트 경험자"
한국딥러닝,-,-,"서울특별시 서초구 강남대로 537, 브랜드칸 타워 6층",딥러닝,"■ 이런 일을 하게 됩니다A. 반응형 Web 및 App의 UX 설계 및 UI 디자인B. 프로덕트를 관통하는 디자인 시스템의 설계와 구축을 통한 일관된 사용성C. 비즈니스 전략의 이해와 프로덕트를 통한 목표 달성- 비즈니스의 요구사항이 고객에게 잘 전달될 수 있도록 고민하고 시각화합니다.- 디자인 변동이 필요한 상황에서 iteration에 적극적으로 참여하며 지속해서 디자인을 개선합니다.D. 사용자 관점의 문제 정의와 데이터에 근거한 개선- 사용자들이 가진 문제점을 찾고 니즈를 충족시키기 위해 끊임없이 개선합니다.- 유저 테스트를 통해 사용자 요구사항을 확인하고, 프로덕트가 최선의 사용자 경험을 제공하도록 노력합니다.E. 여러 직군과의 협업을 통한 문제 해결- 기획부터 출시까지 최적의 디자인이 적용될 수 있도록 PO, Engineer, Biz팀과 긴밀하게 협업합니다.- 디자인 QA, 피드백 과정을 통해서 발견된 문제를 해결합니다.","■ 이런 분과 함께하고 싶습니다- Figma, Sketch, AdobeXD 등 디자인 툴을 사용하는데 어려움이 없으신 분- 반응형 Web/App의 UX,UI를 담당 해보신 분 (Web이 중요합니다!)- Design System의 설계/구축/운영/관리에 대한 이해가 있으신 분- 사용자 관점에서 프로덕트를 바라보실 수 있는 분■ 이런 분이면 더 좋아요!- E-Commerce 플랫폼을 디자인 해보신 분- 무형의 제품을 판매하는 형태의 서비스를 디자인 해보신 분- CSS에 대한 기본적인 이해가 있으신 분- 글로벌 대상 서비스 혹은 프로덕트 런칭 경험이 있으신 분- 애자일한 환경에서 업무가 가능하신 분- 디자이너로서 기획부터 런칭까지 end to end 업무 경험이 있으신 분"
룩코,2년,-,"서울 강남구 테헤란로 43길 18, SC빌딩 6층",딥러닝,"- 의류 이미지 속성 추출/탐지 및 이미지 검색 모델 학습- 딥 러닝 알고리즘 개발 및 평가- 모델 성능 분석 및 성능 개선- 데이터 엔지니어 및 라벨러와의 원활한 소통, 데이터 분석 및 개선 방향성 제시, 관리- ML 모델링에만 집중하지 않고, 데이터의 의미와 상태를 끊임없이 개선[연구 팀은 이렇게 일해요]1. 문제정의 (타 팀과 함께 수행)- 고객 문제 정의 → 솔루션 도출 → 필요한 인공지능 기술 정의 → 중장기 목표 수립 (2-3개월)2. 연구 수행 (에자일 + 연구)- 기존 연구 분석 (선행 연구 및 데이터 분석)- 데이터 생산 및 검수- 모델링 및 최적화- 서비스 통합을 위한 API 구축 및 모델 배포 (Docker)3. 사용하는 툴 / 환경- 자체 라벨링 및 데이터 관리를 위한 백오피스를 활용- 성능 최적화를 위한 별도의 소프트웨어 서비스 활용- RTX 3090 등 고성능 GPU 25대 이상 자체 보유 (서버 다수)","- Python 언어로 원하는 것을 개발/구현을 자유롭게 하실 수 있는 분- DL Framework (Pytorch, Tensorflow, Keras) 중 1가지 이상을 자유롭게 이용 가능하신 분- 논문에 기술된 내용을 이해하고, 이를 구현 가능하신 분- 관련 분야 석사학위 이상 소지자 혹은 최소 2년 이상의 경력자- 단순히 ""연구""적으로 의미가 깊은 것 보다는, 실제 서비스에 필요하고 사용자들의 편의성을 높이는 기술 개발에 대한 관심- Notion/Slack을 통한 커뮤니케이션, Github를 통한 버전관리에 익숙하신 분- 상용 딥러닝 모델 구현 경험이 있으신 분- MLflow, WandB, Neptune 관련 기술 및 경험이 있으신 분- Docker, Kubernetes 환경에서 연구 및 개발 경험이 있으신 분- MLOps 에 대한 관심 혹은 경험- 데이터의 통계적 분석과 모델 분석을 통한 insight가 있으신 분- 스스로 문제를 파악하고 가설을 제기하고 실험을 통해 검증하는 것을 좋아하는 분- 패션 이미지 데이터에 대한 관심이 많은 분현재 사용하는 기술- DL: Pytorch- VCS: Git- 커뮤니케이션: Notion, Slack"
스카이랩스(SkyLabs),-,-,"성남시 분당구 판교로 255번길 58, 씨즈타워 703호",딥러닝,"- 생체 신호 기반 딥러닝/머신러닝 모델 개발- 내부 토론식 세미나를 통해 문제점 및 해결방안 도출- 데이터 전처리, 통계 기반 데이터 분석","- 딥러닝/머신러닝에 대한 개념적인 이해 및 모델링 경험- 논문 기반 분석 및 모델링 능력을 보유하신 분- Python 프로그램 개발 능력- Tensorflow/PyTorch 등 딥러닝 프레임워크 개발 경험자- 데이터에 대한 통계학적 이해 및 분석 경험- 병역특례 전문연구요원 가능- 디지털 신호처리 알고리즘 개발 경험자- 통계학과, 응용수학과, 산업공학, 전자공학, 컴퓨터공학 등 관련 분야 전공자- 딥러닝 논문을 코드로 구현하고 실험/분석 역량 보유자- 의료, 보건 헬스케어 관련 기초 지식 보유 또는 관련 프로젝트 경험자"
뉴로다임,1년,연봉업계평균이상,서울시 성동구 성수일로 77 서울숲 IT 밸리 805호,딥러닝,", 시계열 데이터를 이용한 예측 및 이상 감지- 구조물 이상 감지, 장비 예지 보전, 질병 예측/진단 등, Object Detection 및 Object Tracking 연구 및 구현- 교통정보 영상인식, 행동 이상 감지 등",", 나이/성별 : 무관, 군필(남성의 경우), 신입 : AI 관련 학과 대학원 졸 이상, 경력 : 프로그래밍 관련 학과 대학교 졸업 및 AI 경력 1년 이상(대학원 AI 전공자의 경우 AI 경력 2년 인정), 컴퓨터/시스템 공학, 전기/전자공학, 수학/통계학 전공자, 통계 분석 능숙자, 컴퓨터 활용 능력 우수"
딥브레인에이아이,24년,-,서울특별시 강남구 역삼로 7길 6,딥러닝,", 영상처리 알고리듬(모델)개발(landmark detection, 3D reconstraction, image restruction 등), 사람의 얼굴, 신체 관련 영상처리",", 알고리듬(모델)에 기반한 영상처리 및 컴퓨터 그래픽 전공자 또는 경력자, 석사 이상 신입 (24년 편입 전문연구요원), ffmpeg, openCV, dlib 등을 개발 경험자, 영상 스트리밍 기술 개발 경험, 관련 딥러닝 모델 연구/개발자 우대(Tensor Flow, PyTouch), 다양한 프로그래밍 경력, 영상처리 또는 컴퓨터공학 전공"
